{
  "channels": [
    {
      "dt_sec": 0.06666666666666667,
      "name": "gripper",
      "t0_sec": 0.0,
      "unit": "normalized",
      "values": [
        0.0709588130315145,
        0.0709588130315145,
        0.0709588130315145,
        0.0709588130315145,
        0.0709588130315145,
        0.0709588130315145,
        0.0709588130315145,
        0.0709588130315145,
        0.0709588130315145,
        0.0709588130315145,
        0.0709588130315145,
        0.0709588130315145,
        0.0709588130315145,
        0.0709588130315145,
        0.0709588130315145,
        0.07096498939069038,
        0.07150512780013148,
        0.08030618873843891,
        0.118043911339699,
        0.19725128573739303,
        0.31214315305478163,
        0.4342097442995291,
        0.5299972424553534,
        0.5861490334659343,
        0.613938834155543,
        0.6271871376445988,
        0.6354621955620231,
        0.6424979263819092,
        0.6463384023732561,
        0.6472280363167644,
        0.6472821735039047,
        0.6472827911376953,
        0.6472827911376953,
        0.6472827911376953,
        0.6472827911376953,
        0.6472827911376953,
        0.6472827911376953,
        0.6472827911376953,
        0.6472827911376953,
        0.6472827911376953,
        0.6472827911376953,
        0.6472827911376953,
        0.6472827911376953,
        0.6472827911376953,
        0.6472827911376953,
        0.6472824823151277,
        0.6472469207540748,
        0.6460607197918088,
        0.6321578809374806,
        0.5789759440661033,
        0.47958431083197695,
        0.35391883611754704,
        0.23854096069765035,
        0.16285862075583962,
        0.12381980049855415,
        0.11219906990472953,
        0.11079868054838318,
        0.11036052505911445,
        0.10943933300629022,
        0.10906087354888194,
        0.1090345768796333,
        0.10903426806132,
        0.10903426806132,
        0.10903426806132,
        0.10903426806132,
        0.10903426806132,
        0.10903426806132,
        0.10903426806132,
        0.10903426806132,
        0.10903426806132,
        0.10903426806132,
        0.10903426806132,
        0.10903426806132,
        0.10903426806132,
        0.10903426806132,
        0.10903426806132,
        0.10903426806132,
        0.10903426806132,
        0.10903426806132,
        0.10903426806132,
        0.10903426806132,
        0.10903488569794662,
        0.10909211130688937,
        0.11025645025315593,
        0.1189005618989202,
        0.1512231290139937,
        0.2239133693739137,
        0.3317842374692044,
        0.4430207283592735,
        0.5338253663246387,
        0.595941527296397,
        0.6279806860047052,
        0.6396282343144672,
        0.6419523930592106,
        0.6420560361177226,
        0.6411120762442828,
        0.6309584760679259,
        0.5910859062846556,
        0.5084969468119532,
        0.390034164897377,
        0.26645404037576503,
        0.17047597153618177,
        0.11654348750490762,
        0.09137957877528516,
        0.07982948206803933,
        0.07539306445202659,
        0.07442206672855528,
        0.07361070330605984,
        0.07176894106142206,
        0.07101202388446765,
        0.07095943066672303,
        0.0709588130315145,
        0.0709588130315145,
        0.0709588130315145,
        0.0709588130315145,
        0.0709588130315145,
        0.0709588130315145,
        0.0709588130315145,
        0.0709588130315145,
        0.0709588130315145,
        0.0709588130315145,
        0.0709588130315145,
        0.0709588130315145,
        0.0709588130315145,
        0.0709588130315145,
        0.0709588130315145,
        0.0709588130315145,
        0.0709588130315145,
        0.0709588130315145,
        0.0709588130315145,
        0.0709588130315145,
        0.0709588130315145,
        0.0709588130315145,
        0.0709588130315145,
        0.0709588130315145,
        0.0709588130315145,
        0.0709588130315145,
        0.0709588130315145,
        0.0709588130315145,
        0.0709588130315145,
        0.0709588130315145,
        0.0709588130315145,
        0.0709588130315145,
        0.0709588130315145,
        0.0709588130315145,
        0.0709588130315145,
        0.0709588130315145,
        0.0709588130315145,
        0.0709588130315145,
        0.0709588130315145,
        0.0709588130315145
      ]
    },
    {
      "dt_sec": 0.06666666666666667,
      "name": "eef_velocity",
      "t0_sec": 0.0,
      "unit": "m/s",
      "values": [
        0.0,
        0.0,
        0.0,
        0.0,
        0.0,
        0.0,
        3.1038347235720243e-06,
        0.00027358143942099217,
        0.004602796273127934,
        0.021373169844773433,
        0.042938450732238835,
        0.051009502241491235,
        0.05872392762447688,
        0.06421148217848116,
        0.050588484445964026,
        0.03677456499712498,
        0.044826882963495226,
        0.0538936945335535,
        0.053950319823166226,
        0.0604476595065853,
        0.06989517763409875,
        0.0885733180206899,
        0.11330815472957079,
        0.14677155714869022,
        0.18140482644532702,
        0.19557420893895403,
        0.18450206281893344,
        0.1434805931094396,
        0.09846027386180892,
        0.057709011867150016,
        0.02470725498583492,
        0.014657757374621754,
        0.017383879853393146,
        0.026297296388513556,
        0.03784245900356893,
        0.05806858575867032,
        0.08254117488165352,
        0.0951235956598063,
        0.09004977839176855,
        0.08071393163990492,
        0.06891318323614612,
        0.06401471329279286,
        0.07386145888418666,
        0.08785770474799165,
        0.0870092985496259,
        0.06460775492316001,
        0.03760484621976451,
        0.02969103913312543,
        0.04252316958986177,
        0.04412150580896177,
        0.03910217659524364,
        0.030773278632813737,
        0.014564833594410787,
        0.007045514565082695,
        0.003946134233951987,
        0.0012564008971023726,
        0.004240825881734965,
        0.02547916613832702,
        0.07784637197077242,
        0.1487151615770975,
        0.20995165603118182,
        0.2409242281894594,
        0.24680180663871168,
        0.2460833671982525,
        0.2291432670450593,
        0.19414854988274083,
        0.15451625252574164,
        0.15826580522001438,
        0.17072640159685176,
        0.14294243400611206,
        0.11939424371439813,
        0.11178999030784217,
        0.10685448811653231,
        0.0951386961278364,
        0.08328047275919992,
        0.07291784505064128,
        0.06499401894253516,
        0.0625469145588558,
        0.0714757309847294,
        0.08170290677665412,
        0.0784696052816436,
        0.07109372578310513,
        0.057504903881422334,
        0.04086929044696877,
        0.02335060227152376,
        0.007720417565788621,
        0.003840677120933397,
        0.001433810131958752,
        0.00019379089355078645,
        0.0002286940681228068,
        0.0035329583291500346,
        0.022363462936981923,
        0.07413908251996165,
        0.15259279006280127,
        0.223917227010906,
        0.27410718098800874,
        0.2888346060492344,
        0.2637305354757222,
        0.21999937874056996,
        0.19259501382344424,
        0.191759687461684,
        0.19685402491061726,
        0.19010151606741688,
        0.1979808984251365,
        0.20865145634594406,
        0.2067525131786323,
        0.20519849589981826,
        0.20018815408959087,
        0.18183304838329778,
        0.156468871477557,
        0.1424564403102357,
        0.1467496718168071,
        0.1616897263298521,
        0.15642026373422804,
        0.10716989968313895,
        0.042744536490766316,
        0.012489162387630391,
        0.0037194663323451994,
        0.0006867389885404604,
        3.934123847617855e-05,
        4.427163226198727e-07,
        0.0,
        0.0,
        0.0,
        0.0,
        0.0,
        0.0,
        0.0,
        0.0,
        0.0,
        0.0,
        0.0,
        0.0,
        0.0,
        0.0,
        0.0,
        0.0,
        0.0,
        0.0,
        0.0,
        0.0,
        0.0,
        0.0,
        0.0,
        0.0,
        0.0,
        0.0,
        0.0,
        0.0,
        0.0,
        0.0
      ]
    }
  ],
  "duration_sec": 10.066667,
  "episode_id": "episode_000000",
  "schema_version": "0.1.0"
}